id,name,type,level,description,difficulty,aliases,url,resource_type
l3_feature_normalization_in_polynomial,多项式特征标准化,KnowledgePoint,L3,在多项式回归中，将x^i除以i!以避免高阶项数值过大，从而稳定训练过程的技术。,中等,polynomial feature normalization,,
l3_weighted_empirical_risk_minimization,加权经验风险最小化,KnowledgePoint,L3,通过为每个样本分配权重来修正分布偏移的经验风险最小化方法。,中等,weighted empirical risk minimization,,
l3_logistic_regression_for_density_ratio_estimation,用于密度比估计的对数几率回归,KnowledgePoint,L3,通过训练二元分类器区分源分布和目标分布样本来估计重要性权重的方法。,高,"logistic regression for density ratio estimation,importance weighting via logistic regression",,
l3_confusion_matrix_based_label_shift_correction,基于混淆矩阵的标签偏移纠正,KnowledgePoint,L3,利用分类器在验证集上的混淆矩阵和测试集预测分布求解线性系统以估计目标标签分布的方法。,高,"confusion matrix based label shift correction,black box shift estimation",,
l3_online_model_update,在线模型更新,KnowledgePoint,L3,在新数据到来时逐步更新模型参数以适应缓慢概念偏移的技术。,中等,"online model update,incremental learning",,
l3_feature_label_pair_construction,特征-标签对构造,KnowledgePoint,L3,"将时间序列数据转换为监督学习格式，其中特征为[x_{t-τ}, ..., x_{t-1}]，标签为x_t。",中等,"feature-label pair creation,sliding window transformation",,
l3_mlp_for_sequence_prediction,使用多层感知机进行序列预测,KnowledgePoint,L3,构建包含两个全连接层和ReLU激活函数的MLP模型，用于基于固定长度历史窗口预测下一时间步。,中等,"MLP-based sequence predictor,feedforward network for time series",,
l3_recursive_multistep_forecasting,递归多步预测实现,KnowledgePoint,L3,通过逐步使用模型自身预测结果作为后续输入，实现k步以上的未来预测。,高,"recursive forecasting,autoregressive multi-step prediction",,
l3_k_step_prediction_evaluation,k步预测评估,KnowledgePoint,L3,通过构建包含不同预测步长（如1、4、16、64）的预测结果，评估模型在不同时间跨度下的性能衰减。,高,"k-step ahead evaluation,multi-horizon forecasting assessment",,
l3_predict_next_in_sequence,序列后续预测,KnowledgePoint,L3,基于已有序列（如数字序列、文本、时间序列）预测下一个或多个元素的任务，是RNN的典型应用之一。,中等,"next-token prediction,sequence continuation",,
l3_state_variable_update,状态变量更新机制,KnowledgePoint,L3,RNN中通过将前一时刻的隐藏状态与当前输入结合，经由非线性变换更新当前隐藏状态的具体实现方式。,中等,"hidden state update,recurrent state update",,
l3_implement_one_hot_encoding,实现独热编码,KnowledgePoint,L3,使用深度学习框架（如PyTorch、TensorFlow、PaddlePaddle等）的内置函数将整数索引张量转换为三维独热编码张量，并调整维度顺序为（时间步数，批量大小，词表大小）。,基础,"apply one-hot encoding,convert indices to one-hot vectors",,
l3_define_rnn_parameters,定义RNN模型参数,KnowledgePoint,L3,编写函数创建输入-隐藏权重W_xh、隐藏-隐藏权重W_hh、隐藏偏置b_h、隐藏-输出权重W_hq和输出偏置b_q，并初始化为小随机值，同时启用梯度追踪。,中等,"define RNN weights and biases,initialize RNN parameters from scratch",,
l3_implement_init_rnn_state,实现隐状态初始化函数,KnowledgePoint,L3,"编写init_rnn_state函数，返回一个包含全零张量的元组，张量形状为（batch_size, num_hiddens），用于RNN模型的初始隐状态。",基础,"initialize hidden state function,create zero hidden state",,
l3_implement_rnn_step_loop,实现RNN时间步循环计算,KnowledgePoint,L3,在rnn函数中遍历输入序列的时间步，对每个时间步执行H = tanh(X @ W_xh + H @ W_hh + b_h)和Y = H @ W_hq + b_q，并拼接所有输出。,中等,"RNN step-by-step implementation,manual RNN forward loop",,
l3_wrap_rnn_in_class,封装RNN模型为类,KnowledgePoint,L3,创建RNNModelScratch类，封装参数初始化、前向函数调用和隐状态管理，支持__call__方法以兼容训练流程。,中等,"RNN model class wrapper,scratch RNN class implementation",,
l3_implement_prediction_with_warmup,实现带预热期的预测函数,KnowledgePoint,L3,编写predict_ch8函数，先遍历prefix字符更新隐状态（预热），再循环生成指定数量的新字符，每次选择概率最大的词元作为输出。,高,"character prediction with warm-up,RNN text generation function",,
l3_compute_and_clip_gradients,计算并裁剪梯度,KnowledgePoint,L3,在反向传播后计算所有参数梯度的L2范数，若超过阈值theta，则将所有梯度乘以theta/norm进行缩放，防止梯度爆炸。,高,"gradient norm calculation and clipping,clip gradients by global norm",,
l3_train_rnn_epoch_with_state_management,实现带状态管理的RNN训练轮次,KnowledgePoint,L3,编写train_epoch_ch8函数，根据采样方式（随机/顺序）决定是否重置隐状态，在顺序采样时分离历史梯度，并在参数更新前应用梯度裁剪。,高,"RNN training epoch with state handling,train RNN with gradient clipping",,
l3_define_rnn_layer_with_api,使用高级API定义RNN层,KnowledgePoint,L3,利用深度学习框架（如PyTorch、TensorFlow、MXNet、Paddle）的内置函数创建具有指定隐藏单元数的单层RNN,基础,"define RNN layer with high-level API,create RNN layer using framework",,
l3_initialize_hidden_state_by_framework,按框架规范初始化隐状态,KnowledgePoint,L3,根据不同深度学习框架（如调用begin_state、创建零张量等）正确初始化RNN的初始隐状态,基础,"initialize hidden state per framework,framework-specific hidden state init",,
l3_construct_complete_rnn_model_class,构建完整RNN模型类,KnowledgePoint,L3,封装RNN层和输出层（如线性层或Dense层）到一个自定义模型类中，并实现前向传播和状态初始化方法,中等,"build complete RNN model class,wrap RNN and output layer in class",,
l3_train_rnn_with_high_level_api,使用高级API训练RNN模型,KnowledgePoint,L3,基于框架优化的RNN实现，使用预定义训练函数（如train_ch8）进行模型训练和预测,基础,"train RNN with high-level API,use optimized RNN for training",,
l3_load_text_data,加载文本数据,KnowledgePoint,L3,将文本文件读取到内存中，通常以多行字符串列表形式存储，并进行基础清洗（如去除标点、转小写）。,基础,"read text data,load corpus",,
l3_tokenize_into_words_or_chars,按单词或字符进行词元化,KnowledgePoint,L3,实现将文本行拆分为单词列表（通过空格分割）或字符列表（逐字符切分）的具体方法。,基础,"word tokenization,character tokenization",,
l3_build_vocab_with_frequency_filtering,基于频率构建词表,KnowledgePoint,L3,统计所有词元频率，按出现次数排序，过滤低于最小频率的词元，并为保留词元分配唯一数字索引，同时处理未知词元和特殊保留词元。,中等,"frequency-based vocabulary construction,build vocab with min_freq",,
l3_convert_tokens_to_indices,将词元转换为数字索引,KnowledgePoint,L3,利用已构建的词表，将词元列表映射为对应的整数索引序列，供模型输入使用。,基础,"token to index mapping,numerical encoding of tokens",,
l3_integrate_text_preprocessing_pipeline,整合文本预处理流程,KnowledgePoint,L3,将文本加载、词元化（如按字符）、词表构建和索引转换等步骤封装为一个端到端的函数，输出语料索引列表和词表对象。,中等,"text preprocessing pipeline,end-to-end text processing",,
l3_estimate_unigram_probability,估计一元语法概率,KnowledgePoint,L3,通过统计单词在语料库中的出现次数除以总词数来估计单个词的概率，例如 P̂(deep) = count(deep) / total_words。,基础,unigram probability estimation,,
l3_estimate_bigram_probability,估计二元语法条件概率,KnowledgePoint,L3,"通过统计连续词对的出现次数除以前一个词的总出现次数来估计条件概率，例如 P̂(learning|deep) = count(deep, learning) / count(deep)。",中等,bigram probability estimation,,
l3_apply_laplace_smoothing_formula,应用拉普拉斯平滑公式,KnowledgePoint,L3,"使用带超参数的平滑公式计算一元、二元、三元语法的概率，例如 P̂(x'|x) = (n(x,x') + ε₂·P̂(x')) / (n(x) + ε₂)。",高,apply Laplace smoothing,,
l3_generate_random_subsequences,生成随机子序列,KnowledgePoint,L3,实现随机采样函数 seq_data_iter_random，从长序列中随机选择起始位置并生成固定长度的特征-标签对。,高,random subsequence generation,,
l3_generate_sequential_subsequences,生成顺序子序列,KnowledgePoint,L3,实现顺序分区函数 seq_data_iter_sequential，从长序列中按顺序划分并生成相邻的小批量子序列。,高,sequential subsequence generation,,
l3_construct_vocab_from_corpus,从语料构建词表,KnowledgePoint,L3,使用 d2l.Vocab 对分词后的语料进行词频统计并构建词汇表，支持获取高频词和频率分布。,基础,"vocab construction,build vocabulary",,
l3_full_bptt_computation,完全BPTT计算,KnowledgePoint,L3,按照BPTT公式完整计算所有时间步的梯度，包括对所有历史隐状态的依赖，虽然理论上精确但计算开销大且易导致梯度爆炸，在实践中很少使用。,高,"full backpropagation through time,complete BPTT",,
l3_regular_truncation_strategy,规则截断策略,KnowledgePoint,L3,将输入序列划分为固定长度的子序列，在每个子序列内执行BPTT，并在子序列边界处调用detach()函数分离梯度，这是实践中最常用的方法。,中等,"regular truncation,fixed-length truncation",,
l3_gradient_detachment_in_rnn,循环神经网络中的梯度分离,KnowledgePoint,L3,在实现截断BPTT时，通过调用如PyTorch中的detach()函数，切断计算图中跨时间步的梯度回传路径，防止梯度累积过长。,中等,"gradient detachment,detaching hidden states",,
l3_recursive_gradient_calculation,隐状态梯度的递归计算,KnowledgePoint,L3,在BPTT中，利用递推公式 ∂L/∂h_t = W_hh^T ∂L/∂h_{t+1} + W_qh^T ∂L/∂o_t 从后向前依次计算每个时间步的隐状态梯度。,高,"recursive hidden state gradient,backward recurrence for h_t",,
l3_weight_gradient_accumulation,权重梯度的累加计算,KnowledgePoint,L3,在BPTT中，对每个时间步的局部梯度（如∂L/∂h_t * x_t^T）进行累加，得到最终的权重梯度∂L/∂W_hx和∂L/∂W_hh。,中等,"gradient accumulation over time,summing per-timestep gradients",,
l3_implement_seq2seq_attention_decoder,实现带有Bahdanau注意力的Seq2Seq解码器,KnowledgePoint,L3,在循环神经网络解码器中集成Bahdanau注意力机制，包括初始化解码器状态、在每个时间步计算注意力权重、拼接上下文向量与词嵌入作为RNN输入，并输出预测结果。,高,"implement Bahdanau attention decoder,code attention-based seq2seq decoder",,
l3_visualize_attention_weights,可视化注意力权重,KnowledgePoint,L3,通过热力图展示解码过程中每个查询（目标词）对输入序列各位置（键）的注意力权重，用于分析模型对齐行为。,中等,"visualize attention heatmap,attention weight visualization",,
l3_train_attention_seq2seq_model,训练带注意力机制的序列到序列模型,KnowledgePoint,L3,使用编码器-解码器架构结合Bahdanau注意力进行机器翻译任务的端到端训练，包括数据加载、模型实例化、损失计算和BLEU评估。,高,"train attention-based seq2seq,attention model training",,
l3_parallel_computation_of_heads,多头并行计算,KnowledgePoint,L3,通过张量形状变换（如reshape和transpose）将多个注意力头的计算合并为一个批次操作，以提高计算效率和利用硬件并行性。,高,"parallel computation of multiple heads,batched multi-head computation",,
l3_transpose_qkv_implementation,transpose_qkv函数实现,KnowledgePoint,L3,"实现多头注意力中用于将输入张量从(batch_size, seq_len, num_hiddens)变换为(batch_size*num_heads, seq_len, num_hiddens/num_heads)的函数，以便并行计算多个头。",高,"transpose_qkv,query-key-value transposition",,
l3_transpose_output_implementation,transpose_output函数实现,KnowledgePoint,L3,"实现多头注意力中用于将并行计算后的多头输出从(batch_size*num_heads, seq_len, num_hiddens/num_heads)恢复为(batch_size, seq_len, num_hiddens)的函数。",高,"transpose_output,output concatenation and reshaping",,
l3_multihead_attention_class_implementation,MultiHeadAttention类实现,KnowledgePoint,L3,实现完整的多头注意力模块，包括线性投影层、注意力汇聚、多头并行计算和输出投影的完整流程。,高,"MultiHeadAttention implementation,multi-head attention module coding",,
l3_generate_valid_attention_weights,生成有效的注意力权重,KnowledgePoint,L3,通过对随机矩阵应用softmax运算，确保每行构成有效的概率分布，从而生成合法的注意力权重,中等,"generate valid attention weights,softmax normalization for attention",,
l3_nadaraya_watson_kernel_regression,Nadaraya-Watson核回归,KnowledgePoint,L3,1964年提出的非参数回归方法，被视为具有注意力机制的早期机器学习模型，通过对邻近点加权平均进行预测。,中等,"Nadaraya-Watson kernel regression,kernel regression with attention",,
l3_design_attention_models_with_cues,基于注意力提示设计注意力模型,KnowledgePoint,L3,利用注意力提示（如位置、内容等）构建能够动态分配注意力权重的深度学习模型。,中等,designing attention models using cues,,
l3_build_transformer_with_multi_head_self_attention,构建基于多头自注意力的Transformer,KnowledgePoint,L3,实现完整的Transformer架构，包括多头自注意力层、位置编码、前馈网络和残差连接。,高,building Transformer with multi-head self-attention,,
l3_compute_attention_weights_with_gaussian_kernel,使用高斯核计算注意力权重,KnowledgePoint,L3,"根据公式 α(x, x_i) = softmax(-0.5*(x - x_i)^2) 计算查询x与每个键x_i之间的注意力权重，用于非参数注意力汇聚。",中等,compute attention weights with Gaussian kernel,,
l3_implement_parametric_nw_regression,实现带参数的Nadaraya-Watson回归模型,KnowledgePoint,L3,"定义一个神经网络层，包含可学习参数w，通过 α(x, x_i) = softmax(-0.5*((x - x_i)*w)^2) 计算注意力权重，并使用批量矩阵乘法聚合值。",高,"implement parametric NW regression,trainable attention pooling implementation",,
l3_prepare_key_value_pairs_for_training,为训练准备键值对,KnowledgePoint,L3,"将训练数据转换为键值对格式，排除自身样本以避免过拟合，形成形状为(n_train, n_train-1)的键和值张量用于模型训练。",中等,prepare key-value pairs for attention training,,
l3_visualize_attention_weights_heatmap,可视化注意力权重热力图,KnowledgePoint,L3,使用热力图展示查询（测试输入）与键（训练输入）之间的注意力权重分布，验证注意力机制是否关注邻近样本。,基础,"visualize attention heatmap,attention weight visualization",,
l3_implement_masked_softmax,实现掩蔽softmax函数,KnowledgePoint,L3,编写支持1D或2D有效长度输入的masked_softmax函数，对超出有效长度的位置使用大负数掩蔽，确保softmax输出为0。,中等,"masked softmax implementation,implement masked softmax",,
l3_implement_additive_attention_layer,实现加性注意力层,KnowledgePoint,L3,构建包含可学习参数W_q、W_k和w_v的加性注意力神经网络模块，支持批量输入并集成掩蔽softmax和dropout。,高,"additive attention implementation,implement additive attention",,
l3_implement_scaled_dot_product_attention_layer,实现缩放点积注意力层,KnowledgePoint,L3,构建基于矩阵乘法的缩放点积注意力模块，自动处理查询-键点积、维度缩放、掩蔽softmax和加权值聚合。,中等,"scaled dot-product attention implementation,implement scaled dot-product attention",,
l3_multi_head_self_attention_implementation,多头自注意力实现,KnowledgePoint,L3,使用多头注意力机制对输入张量执行自注意力计算，输入和输出形状保持一致，适用于批量处理序列数据。,高,"multi-head self-attention implementation,多头自注意力计算",,
l3_sinusoidal_positional_encoding_implementation,正弦位置编码实现,KnowledgePoint,L3,基于正弦和余弦函数的位置编码实现方法，通过交替使用sin和cos函数在不同维度上生成具有频率递减特性的位置嵌入矩阵。,高,"sinusoidal positional encoding,三角函数位置编码",,
l3_access_specific_layer_params,访问特定层的参数,KnowledgePoint,L3,通过索引或命名方式访问神经网络中某一层的权重和偏置参数，例如 net[1].bias.data()。,基础,"access layer-specific parameters,layer parameter indexing",,
l3_collect_all_parameters,一次性收集所有参数,KnowledgePoint,L3,使用框架提供的方法（如 collect_params()、named_parameters() 或 get_weights()）递归地获取整个模型的所有参数。,基础,"collect all model parameters,recursive parameter collection",,
l3_access_nested_block_params,从嵌套块中访问参数,KnowledgePoint,L3,通过多级索引（如 rgnet[0][1][0].bias）访问嵌套神经网络模块中的深层参数。,中等,"nested block parameter access,hierarchical parameter indexing",,
l3_builtin_initialization,使用内置初始化方法,KnowledgePoint,L3,调用深度学习框架提供的初始化器（如 Normal、Constant、Xavier）对模型参数进行初始化。,基础,"built-in initialization,framework-provided initializers",,
l3_custom_initialization,自定义参数初始化,KnowledgePoint,L3,实现用户自定义的初始化逻辑（如混合均匀分布与零值），通过继承 Initializer 类或定义初始化函数完成。,高,"custom weight initialization,user-defined initializer",,
l3_direct_parameter_assignment,直接修改参数值,KnowledgePoint,L3,"绕过初始化器，直接对参数张量赋值（如 net[0].weight.data()[0,0] = 42）以实现精确控制。",中等,"direct parameter assignment,manual weight setting",,
l3_implement_parameter_binding,实现参数绑定,KnowledgePoint,L3,在不同层之间共享同一组参数对象，确保它们在训练过程中同步更新，通常通过传递 params 引用或重复使用同一层实例实现。,高,"implement parameter tying,shared layer instantiation",,
l3_define_custom_block,定义自定义块,KnowledgePoint,L3,通过继承框架基类（如nn.Block、nn.Module等），实现构造函数和前向传播函数来创建自定义神经网络块。,中等,"implement custom block,create custom module",,
l3_implement_sequential_block,实现顺序块,KnowledgePoint,L3,通过维护有序模块列表并依次调用其前向传播函数，构建自定义的顺序执行块（如MySequential）。,中等,"build sequential container,implement MySequential",,
l3_use_control_flow_in_forward,在前向传播中使用控制流,KnowledgePoint,L3,在自定义块的前向传播函数中嵌入Python控制流（如while循环、条件判断）以实现动态计算逻辑。,高,"dynamic computation graph,control flow in forward pass",,
l3_share_layer_parameters,共享层参数,KnowledgePoint,L3,在模型中多次调用同一个层实例，使其参数在不同位置被复用，实现参数共享。,中等,"parameter sharing,reuse layer",,
l3_nest_blocks_recursively,递归嵌套块,KnowledgePoint,L3,将块作为子组件嵌套在其他块中，形成层次化、模块化的复杂网络结构。,高,"nested blocks,hierarchical model construction",,
l3_infer_layer_shapes_from_input,从输入数据推断层参数形状,KnowledgePoint,L3,当数据首次通过未初始化的网络时，框架根据输入维度依次推断每一层权重矩阵的形状，从而完成参数初始化。,中等,"shape inference from input,dynamic shape resolution",,
l3_initialize_network_with_data_pass,通过数据传递触发网络初始化,KnowledgePoint,L3,在延后初始化机制下，调用模型处理实际输入数据（如 net(X)）会触发框架自动完成所有未初始化层的参数初始化。,基础,"trigger initialization via forward pass,data-driven initialization",,
l3_implement_parametric_custom_layer,实现带参数的自定义层,KnowledgePoint,L3,在自定义层中通过框架提供的参数管理机制（如params.get、nn.Parameter、add_weight等）声明可训练参数，并在前向传播中使用这些参数进行计算。,高,"building layer with trainable parameters,building non-parametric layer,implementing parametric custom layer,implementing parameterless custom layer",,
l3_integrate_custom_layer_into_model,将自定义层集成到模型中,KnowledgePoint,L3,将自定义层作为组件添加到序列模型（如nn.Sequential）或其他复杂架构中，与其他内置或自定义层组合使用。,中等,"integrating custom layer into neural network,using custom layer in model",,
l3_save_single_tensor,保存单个张量,KnowledgePoint,L3,调用框架的save函数，将单个张量写入指定文件路径。,基础,"save tensor,serialize single tensor",,
l3_load_single_tensor,加载单个张量,KnowledgePoint,L3,调用框架的load函数，从指定文件路径读取并还原单个张量。,基础,"load tensor,deserialize single tensor",,
l3_save_tensor_list,保存张量列表,KnowledgePoint,L3,将多个张量组成列表并通过save函数一次性保存到文件中。,基础,save list of tensors,,
l3_load_tensor_list,加载张量列表,KnowledgePoint,L3,从文件中加载张量列表，并解包为多个独立张量变量。,基础,load list of tensors,,
l3_save_tensor_dict,保存张量字典,KnowledgePoint,L3,将字符串键映射到张量值的字典结构保存到文件，常用于保存模型权重。,中等,"save dictionary of tensors,save state dict",,
l3_load_tensor_dict,加载张量字典,KnowledgePoint,L3,从文件中加载张量字典，用于恢复模型参数或其他结构化张量数据。,中等,"load dictionary of tensors,load state dict",,
l3_save_model_parameters,保存模型参数,KnowledgePoint,L3,调用模型或框架特定方法（如save_parameters、state_dict保存等）将整个网络的可训练参数序列化到文件。,中等,"save model weights,checkpoint model parameters",,
l3_load_model_parameters,加载模型参数,KnowledgePoint,L3,在重新实例化相同模型结构后，从文件加载已保存的参数并注入到模型中，以恢复训练状态。,中等,"load model weights,restore model from checkpoint",,
l3_implement_vgg_block,实现VGG块,KnowledgePoint,L3,在深度学习框架中编写函数实现VGG块，包括指定卷积层数量、输入/输出通道数，并依次添加卷积层（带ReLU激活）和最大汇聚层。,中等,"implement VGG block,code VGG module",,
l3_construct_vgg_network,构建VGG网络,KnowledgePoint,L3,通过循环调用VGG块函数并传入预定义的卷积层数与通道数组合（如conv_arch），堆叠多个VGG块，再连接展平层和全连接层以完成整个VGG网络的构建。,中等,"build VGG network,assemble VGG architecture",,
l3_analyze_layer_output_shapes,分析各层输出形状,KnowledgePoint,L3,通过向网络输入固定尺寸张量（如1×1×224×224），逐层前向传播并打印每层输出的形状，验证空间维度是否按预期减半及通道数变化是否符合设计。,基础,"trace layer shapes,output shape analysis",,
l3_train_vgg_on_fashion_mnist,在Fashion-MNIST上训练VGG,KnowledgePoint,L3,将输入图像调整为224×224，使用轻量化VGG变体，在适当学习率（如0.05）和批量大小（如128）下进行模型训练，并利用GPU加速。,中等,"train VGG on Fashion-MNIST,VGG training pipeline",,
l3_construct_googlenet,构建GoogLeNet模型,KnowledgePoint,L3,按顺序堆叠初始卷积模块、多个Inception块（b3-b5）、最大汇聚层和全局平均汇聚层，最终接分类头，完成完整GoogLeNet网络的搭建。,高,"build GoogLeNet,assemble GoogLeNet architecture",,
l3_channel_reduction_with_1x1,使用1×1卷积进行通道降维,KnowledgePoint,L3,在3×3和5×5卷积前插入1×1卷积层，以减少输入通道数，从而降低计算复杂度和参数量。,中等,"channel reduction with 1x1 convolution,bottleneck with 1x1",,
l3_bn_implementation_fully_connected,全连接层中的批量规范化实现,KnowledgePoint,L3,在全连接层中，批量规范化对每个特征维度（axis=0）计算小批量均值和方差，并进行标准化，随后应用可学习的γ和β参数。,中等,"BN in fully connected layers,dense layer batch norm",,
l3_bn_implementation_convolutional,卷积层中的批量规范化实现,KnowledgePoint,L3,在卷积层中，批量规范化对每个通道（channel）的所有空间位置（height × width）和批量维度上的值联合计算均值和方差，然后对每个通道统一标准化。,中等,"BN in convolutional layers,conv layer batch norm",,
l3_moving_average_update,移动平均均值与方差更新,KnowledgePoint,L3,在训练过程中，通过动量（momentum）机制持续更新移动平均的均值和方差，用于预测阶段的确定性推理。,中等,"moving average update,exponential moving average for BN",,
