id,name,type,level,description,difficulty,aliases,url,resource_type
l1-1,线性代数与概率基础,KnowledgePoint,L1,研究向量空间、线性变换、矩阵运算及其在随机变量、概率分布和统计推断中的应用的数学基础学科。,0.7,"矩阵与概率论,线性代数及概率统计基础,向量、矩阵与概率",,
l1-2,分类算法,KnowledgePoint,L1,分类算法是一类用于将数据样本映射到预定义类别标签的监督学习方法，其核心目标是通过学习输入特征与输出类别的映射关系，实现对未知样本的类别预测。,0.7,"分类模型,监督分类方法,判别模型",,
l1-3,机器学习基础,KnowledgePoint,L1,机器学习基础是指对机器学习的基本概念、主要算法类型及其应用框架的系统性介绍，涵盖监督学习、无监督学习和强化学习等核心范式，以及模型评估与选择的基本方法。,0.7,"机器学习概论,机器学习入门,机器学习核心概念",,
l1-4,生成模型,KnowledgePoint,L1,生成模型是一类通过学习数据分布并能够生成新样本的机器学习模型，其核心目标是模拟数据的潜在分布以合成符合该分布的新数据实例。,0.7,"生成式模型,生成性模型,生成网络",,
l1-5,优化算法,KnowledgePoint,L1,优化算法是指用于求解目标函数极值问题的一类计算方法，通过迭代或解析方式在可行域内寻找最优解，区别于一般算法的通用性，其核心在于目标函数与约束条件的数学建模及求解策略。,0.7,"最优化方法,优化技术,数值优化,算法优化",,
l1-6,注意力机制与自注意力模型,KnowledgePoint,L1,注意力机制是一种通过动态计算输入元素间相关性以加权聚合信息的模型结构，自注意力模型则进一步允许模型在相同输入序列内部建立依赖关系，实现对局部与全局语义的捕捉。,0.7,"注意力机制,自注意力机制,注意力模型",,
l1-7,计算机视觉,KnowledgePoint,L1,计算机视觉是研究如何使计算机模拟人类视觉系统，以感知、理解并解释图像或视频内容的学科，涵盖图像处理、特征提取、目标检测、场景理解等核心技术和应用。,0.7,"图像识别与视觉计算,视觉计算,计算机视觉与图像理解",,
l1-8,自然语言处理基础与应用,KnowledgePoint,L1,研究自然语言的结构、语义及生成机制，并探讨其在信息理解、文本生成、机器翻译等任务中的计算模型与应用方法的学科领域。,0.7,"NLP基础与实践,自然语言处理概论,NLP技术与应用",,
l1-9,深度学习概述与前沿,KnowledgePoint,L1,本主题系统阐述深度学习的基本原理、典型模型结构及其在当前研究与应用中的最新发展与趋势。,0.7,"深度学习基础与进展,深度学习核心与趋势,深度学习概论与研究方向",,
l1-10,神经网络基础,KnowledgePoint,L1,神经网络基础是研究人工神经网络的基本结构、工作原理及其训练机制的学科领域，涵盖感知机、多层前馈网络、激活函数、损失函数与反向传播等核心概念。,0.7,"神经网络概述,神经网络简介,神经网络原理",,
l1-11,循环神经网络与长短期记忆网络,KnowledgePoint,L1,循环神经网络（RNN）是一类用于处理序列数据的神经网络架构，通过引入时间步的循环连接来建模序列依赖；长短期记忆网络（LSTM）是RNN的一种改进形式，通过门控机制有效缓解长期依赖问题。,0.7,"RNN与LSTM,循环网络与LSTM模型,递归神经网络与长短期记忆",,
l1-12,卷积神经网络,KnowledgePoint,L1,一种通过局部感受野、权值共享和层次化特征提取机制，专门用于处理具有网格结构数据（如图像）的深度神经网络架构。,0.7,"卷积网络,CNN,卷积深度网络",,
l2_adagrad_algorithm,AdaGrad算法,KnowledgePoint,L2,一种自适应学习率优化算法，通过累加历史梯度的平方来动态调整每个参数的学习率，特别适用于稀疏特征场景。,中等,"Adaptive Gradient Algorithm,AdaGrad",,
l2_sparse_features_learning,稀疏特征和学习率,KnowledgePoint,L2,在自然语言处理等任务中，某些特征出现频率极低，导致其参数更新不足；传统全局学习率衰减策略对常见与稀疏特征不均衡，需采用自适应方法。,中等,"sparse features,learning rate for sparse features",,
l2_condition_number,条件数,KnowledgePoint,L2,优化问题中最大特征值与最小特征值的比值，用于衡量问题的病态程度；条件数越大，优化越困难。,中等,"condition number,κ",,
l2_diagonal_preconditioning,对角预处理,KnowledgePoint,L2,通过使用目标函数Hessian矩阵的对角元素进行缩放，以改善优化问题的条件数，是一种计算代价较低的近似预处理方法。,高,"diagonal preconditioning,diagonal scaling",,
l2_gradient_variance_as_hessian_proxy,梯度方差作为Hessian代理,KnowledgePoint,L2,在无法计算完整Hessian矩阵的情况下，使用梯度的平方（或方差）作为其对角线的廉价替代，用于自适应学习率调整。,高,"gradient variance proxy,Hessian approximation via gradients",,
l2_adam_algorithm,Adam算法,KnowledgePoint,L2,一种结合动量和自适应学习率的优化算法，使用指数加权移动平均估算梯度的一阶矩（动量）和二阶矩（平方梯度），并进行偏差校正以加速收敛。,中等,"Adam,Adaptive Moment Estimation",,
l2_yogi_algorithm,Yogi算法,KnowledgePoint,L2,Adam算法的改进版本，通过修改二阶矩更新规则，使用符号函数控制更新方向，以解决Adam在某些情况下因方差估计不稳定而发散的问题。,高,"Yogi,Yogi optimizer",,
l2_exponential_weighted_moving_average,指数加权移动平均,KnowledgePoint,L2,用于估算梯度动量和二次矩的统计方法，在Adam等优化器中用于平滑历史梯度信息。,基础,"EWMA,Exponentially Weighted Moving Average",,
l2_bias_correction,偏差校正,KnowledgePoint,L2,在Adam算法中，由于初始状态为零导致早期估计存在偏差，通过除以(1 - β^t)进行校正，以获得无偏估计。,中等,"bias correction,unbiased estimation",,
l2_rmsprop_algorithm,RMSProp算法,KnowledgePoint,L2,一种自适应学习率优化算法，通过使用梯度平方的泄漏平均值（指数移动平均）来调整每个参数的学习率，从而解决Adagrad学习率衰减过快的问题。,中等,"RMSProp,Root Mean Square Propagation",,
l2_leaky_average_of_squared_gradients,梯度平方的泄漏平均,KnowledgePoint,L2,在RMSProp中用于替代Adagrad中累积全部历史梯度平方的方法，通过引入衰减因子γ对历史梯度平方进行指数加权平均，使得算法能更灵活地适应非凸优化问题。,中等,"exponential moving average of squared gradients,leaky averaging",,
l2_adaptive_learning_rate_per_coordinate,按坐标的自适应学习率,KnowledgePoint,L2,为每个参数（坐标）单独调整学习率，基于其历史梯度信息进行缩放，以提升收敛速度和稳定性。,中等,"coordinate-wise adaptive learning rate,per-parameter learning rate adaptation",,
l2_loss_function,损失函数,KnowledgePoint,L2,在深度学习中用于衡量模型预测与真实标签之间差异的函数，也是优化算法试图最小化的对象。,基础,"loss function,objective function,cost function",,
l2_empirical_risk,经验风险,KnowledgePoint,L2,训练数据集上的平均损失，是优化算法直接最小化的目标。,中等,"empirical risk,training error",,
l2_risk,风险,KnowledgePoint,L2,整个数据分布上的期望损失，对应于泛化误差，是深度学习的最终目标。,中等,"risk,expected loss,generalization error",,
l2_local_minimum,局部最小值,KnowledgePoint,L2,目标函数在某点的值小于其邻域内所有其他点的值，但不一定是全局最小值。,中等,local minimum,,
l2_global_minimum,全局最小值,KnowledgePoint,L2,目标函数在整个定义域中的最小值。,中等,global minimum,,
l2_saddle_point,鞍点,KnowledgePoint,L2,梯度为零但既非局部最小值也非局部最大值的点，常见于高维非凸优化问题中。,高,saddle point,,
l2_gradient_vanishing,梯度消失,KnowledgePoint,L2,在某些区域梯度接近于零，导致优化过程停滞，常见于使用如tanh等饱和激活函数的深层网络中。,高,"vanishing gradient,gradient vanishing problem",,
l2_hessian_matrix,Hessian矩阵,KnowledgePoint,L2,目标函数的二阶偏导数组成的矩阵，用于判断临界点的性质（最小值、最大值或鞍点）。,高,"Hessian matrix,黑塞矩阵",,
l2_non_convex_optimization,非凸优化,KnowledgePoint,L2,深度学习中绝大多数优化问题属于非凸优化，其目标函数具有多个局部极小值，难以保证全局最优解。,中等,non-convex optimization,,
l2_convex_optimization,凸优化,KnowledgePoint,L2,在凸目标函数背景下设计和分析优化算法，虽不完全适用于深度学习，但对理解优化原理具有启发性。,中等,convex optimization,,
l2_stochastic_gradient_descent,随机梯度下降,KnowledgePoint,L2,一种在凸目标函数上使用的简单但有效的优化算法，是许多高级优化器的基础。,基础,"SGD,stochastic gradient descent",,
l2_convexity,凸性,KnowledgePoint,L2,凸性在优化算法设计中起关键作用，使得算法分析和测试更容易，即使深度学习中的优化问题通常是非凸的，它们也常在局部极小值附近表现出凸性。,中等,convexity,,
l2_convex_set,凸集,KnowledgePoint,L2,"向量空间中的一个集合，若其中任意两点之间的线段仍完全包含在该集合内，则称为凸集。数学上表示为：对任意a,b∈X和λ∈[0,1]，有λa+(1−λ)b∈X。",基础,convex set,,
l2_convex_function,凸函数,KnowledgePoint,L2,"定义在凸集上的函数f，若对任意x,x'∈X和λ∈[0,1]，满足λf(x)+(1−λ)f(x')≥f(λx+(1−λ)x')，则称f为凸函数。",中等,convex function,,
l2_jensens_inequality,詹森不等式,KnowledgePoint,L2,凸函数的重要性质：对于凸函数f，有∑α_i f(x_i) ≥ f(∑α_i x_i)，其中α_i为非负实数且∑α_i=1；或E_X[f(X)] ≥ f(E_X[X])，即凸函数的期望不小于期望的凸函数。,中等,Jensen's inequality,,
l2_local_minimum_is_global,局部极小值是全局极小值,KnowledgePoint,L2,凸函数的一个关键性质：其任意局部极小值同时也是全局极小值，这保证了优化过程中不会“卡住”在次优解。,中等,local minimum is global minimum,,
l2_sublevel_set_convexity,下水平集的凸性,KnowledgePoint,L2,定义在凸集上的凸函数f的任意下水平集S_b = {x | f(x) ≤ b}也是凸集。,中等,"convexity of sublevel sets,below sets",,
l2_second_derivative_test,二阶导数与凸性,KnowledgePoint,L2,对于二次可微函数，其为凸函数当且仅当Hessian矩阵∇²f半正定（∇²f ⪰ 0）。在一维情况下，等价于f''(x) ≥ 0。,高,"second derivative test for convexity,Hessian condition",,
l2_constrained_optimization,约束优化,KnowledgePoint,L2,在满足一组不等式约束c_i(x) ≤ 0的前提下最小化目标函数f(x)的优化问题，常见于带限制条件的机器学习任务。,高,constrained optimization,,
l2_lagrangian_function,拉格朗日函数,KnowledgePoint,L2,"用于求解约束优化问题的辅助函数，形式为L(x, α) = f(x) + ∑α_i c_i(x)，其中α_i ≥ 0为拉格朗日乘子，通过鞍点优化（对x最小化、对α最大化）求解原问题。",高,"Lagrangian function,Lagrange multipliers",,
l2_penalty_method,惩罚方法,KnowledgePoint,L2,通过在目标函数中添加惩罚项（如权重衰减λ/2||w||²）来近似满足约束条件的优化策略，在实践中比精确满足约束更可靠。,中等,"penalty method,regularization as penalty",,
l2_projection,投影,KnowledgePoint,L2,将任意向量x映射到凸集X中距离最近的点，定义为Proj_X(x) = argmin_{x'∈X} ||x - x'||。常用于梯度裁剪、稀疏约束等场景。,中等,projection onto convex sets,,
l2_momentum_method,动量法,KnowledgePoint,L2,一种优化算法，通过使用过去梯度的指数加权平均（即动量）来加速收敛并减少振荡，特别适用于条件不佳的优化问题。,中等,"momentum,momentum method,gradient descent with momentum",,
l2_leaky_average,泄漏平均值,KnowledgePoint,L2,"在优化中用于计算梯度历史的指数加权平均，形式为 v_t = β v_{t-1} + g_t，其中 β ∈ (0,1)，用于平滑梯度估计。",中等,"leaky average,exponential moving average of gradients",,
l2_poorly_conditioned_optimization,条件不佳的优化问题,KnowledgePoint,L2,指目标函数在不同方向上曲率差异显著的问题（如狭长椭球），导致标准梯度下降收敛缓慢或不稳定。,中等,"ill-conditioned optimization,poorly conditioned problems",,
l2_convex_quadratic_function,凸二次函数,KnowledgePoint,L2,形如 h(x) = 1/2 x^T Q x + x^T c + b 的函数，其中 Q 为正定矩阵，是分析优化算法性能的常用理论模型。,高,"convex quadratic function,quadratic objective",,
l2_learning_rate_scheduling,动态学习率,KnowledgePoint,L2,在优化过程中随时间调整学习率的策略，包括分段常数、指数衰减和多项式衰减等方式，以平衡收敛速度与稳定性。,中等,"learning rate scheduler,adaptive learning rate,learning rate decay,learning rate scheduling,learning rate adjustment",,
l2_warmup_strategy,预热策略,KnowledgePoint,L2,在训练初期逐步增加学习率，避免因初始参数随机性导致的训练不稳定或发散。,中等,"warmup,learning rate warmup",,
l2_polynomial_decay,多项式衰减,KnowledgePoint,L2,一种学习率衰减策略，学习率随训练步数按多项式形式（如 t^{-0.5}）递减。,中等,"polynomial decay,power law decay",,
l2_cosine_scheduler,余弦调度器,KnowledgePoint,L2,基于余弦函数的学习率调度策略，在训练过程中平滑地从初始学习率降至目标学习率。,中等,"cosine annealing,cosine learning rate schedule",,
l2_piecewise_constant_scheduler,分段常数调度器,KnowledgePoint,L2,在预设的训练阶段保持学习率为常量，并在特定时间点按比例降低学习率。,中等,"piecewise constant learning rate,multi-step scheduler",,
l2_multiplicative_decay,乘法衰减,KnowledgePoint,L2,每次更新时将学习率乘以一个小于1的因子，实现指数式衰减，通常设有下界防止过小。,基础,"exponential decay,factor decay",,
l2_minibatch_gradient_descent,小批量随机梯度下降,KnowledgePoint,L2,一种在梯度下降和随机梯度下降之间折中的优化方法，通过使用小批量数据计算梯度，在保持统计效率的同时提升计算效率。,中等,"minibatch SGD update,stochastic gradient update,mini-batch SGD,minibatch gradient descent,小批量SGD",,
l2_vectorization,向量化,KnowledgePoint,L2,利用CPU/GPU的并行计算能力，通过矩阵或张量操作替代循环，提高计算效率的技术。,基础,"batch computation,向量化计算,vectorization",,
l2_cache_hierarchy,缓存层次结构,KnowledgePoint,L2,计算机内存系统中由寄存器、L1/L2/L3缓存和主存组成的层级结构，影响数据访问速度和计算效率。,中等,"cache hierarchy,内存层次结构",,
l2_gradient_variance,梯度方差,KnowledgePoint,L2,在随机优化中，由于使用子集数据估计梯度而引入的统计波动；小批量可降低梯度方差，使更新更稳定。,中等,"gradient variance,梯度噪声",,
l2_gradient_descent,梯度下降,KnowledgePoint,L2,一种通过沿目标函数负梯度方向迭代更新参数以最小化目标函数的优化算法。,基础,"gradient descent,GD",,
l2_learning_rate,学习率,KnowledgePoint,L2,控制每次参数更新步长的超参数，影响优化过程的收敛速度和稳定性。,基础,"learning rate,step size",,
l2_newtons_method,牛顿法,KnowledgePoint,L2,利用目标函数的一阶和二阶导数（Hessian矩阵）进行优化的二阶方法，具有二次收敛速度但计算成本高。,高,"Newton's method,second-order optimization",,
l2_preconditioning,预处理,KnowledgePoint,L2,通过调整参数空间的尺度（如使用对角Hessian的逆）来改善优化效率的技术。,中等,"preconditioning,scaling",,
l2_line_search,线搜索,KnowledgePoint,L2,在梯度方向上自动选择最优学习率以最小化目标函数的技术，常用于传统优化但不适用于大规模深度学习。,中等,"line search,exact line search",,
l2_convergence_analysis,凸目标的收敛性分析,KnowledgePoint,L2,对随机梯度下降在凸目标函数下的收敛行为进行理论分析，证明其在适当学习率下可收敛到最优解。,高,"convergence analysis for convex objectives,SGD convergence theory",,
l2_sampling_without_replacement,无替换采样,KnowledgePoint,L2,在训练过程中每个epoch内遍历所有样本一次且不重复采样的策略，相比有替换采样具有更低方差和更高数据效率。,中等,"sampling without replacement,full pass SGD",,
l2_translation_invariance,平移不变性,KnowledgePoint,L2,指无论目标物体出现在图像中的哪个位置，模型的响应应保持一致或仅发生相应平移的性质。,基础,"translation invariance,spatial invariance",,
l2_locality,局部性,KnowledgePoint,L2,神经网络前几层只关注输入图像的局部区域，而非全局依赖，从而减少计算复杂度并符合图像的自然结构。,基础,"locality,local receptive field",,
l2_convolution_layer,卷积层,KnowledgePoint,L2,通过滑动卷积核对输入进行加权求和操作，生成特征图的神经网络层，是卷积神经网络的核心组成部分。,中等,"convolutional layer,conv layer",,
l2_convolution_kernel,卷积核,KnowledgePoint,L2,用于在卷积操作中对局部区域进行加权的小型可学习权重矩阵，也称为滤波器。,基础,"convolution kernel,filter,weight kernel",,
l2_channels,多通道,KnowledgePoint,L2,卷积神经网络中表示输入或特征图深度维度的概念，每个通道可学习不同类型的特征，支持彩色图像或多特征表示。,中等,"channels,feature maps",,
l2_feature_maps,特征映射,KnowledgePoint,L2,卷积层输出的每个通道所表示的空间化特征图，反映特定模式（如边缘、纹理）的响应强度。,中等,"feature map,activation maps,activation map,feature maps",,
l2_multilayer_perceptron_limitations,多层感知机的限制,KnowledgePoint,L2,在处理高维图像数据时，全连接的多层感知机因参数量过大而难以训练，且无法利用图像的空间结构。,基础,"MLP limitations,fully connected layer drawbacks",,
l2_padding,填充,KnowledgePoint,L2,在输入数据边缘添加额外像素以控制输出特征图尺寸的技术，常用于保持空间维度或增加感受野。,基础,padding,,
l2_stride,步幅,KnowledgePoint,L2,卷积核在输入数据上滑动的步长，影响输出特征图的尺寸和计算密度。,基础,stride,,
l2_pooling_layer,汇聚层,KnowledgePoint,L2,用于在相邻区域聚合信息、降低特征图空间维度并增强平移不变性的层，常见类型包括最大池化和平均池化。,基础,"pooling layer,subsampling layer",,
l2_lenet,LeNet,KnowledgePoint,L2,第一个成功应用的卷积神经网络模型，由Yann LeCun等人提出，用于手写数字识别，奠定了现代CNN的基础架构。,中等,"LeNet-5,LeNet,classic CNN architecture,LeNet architecture",,
l2_lenet_architecture,LeNet架构,KnowledgePoint,L2,LeNet-5是一种早期的卷积神经网络架构，由卷积编码器（两个卷积层）和全连接层密集块（三个全连接层）组成，用于手写数字识别。,基础,"LeNet,LeNet-5,LeNet architecture",,
l2_activation_function_in_cnn,CNN中的激活函数,KnowledgePoint,L2,在卷积神经网络中引入非线性，LeNet使用Sigmoid激活函数，现代CNN多采用ReLU等更高效的激活函数。,基础,"activation function,sigmoid,ReLU",,
l2_flattening_in_cnn,卷积到全连接的展平操作,KnowledgePoint,L2,将卷积块输出的四维张量（批量、通道、高、宽）展平为二维向量，以便输入全连接层。,基础,"flattening,flatten operation,tensor reshaping",,
l2_cross_correlation,互相关运算,KnowledgePoint,L2,卷积层实际执行的运算是互相关运算，即在输入张量上滑动卷积核窗口，对窗口内元素与卷积核进行按元素相乘后求和，得到输出张量中的一个标量值。,基础,"cross-correlation,互相关",,
l2_edge_detection,图像边缘检测,KnowledgePoint,L2,"利用特定设计的卷积核（如[1, -1]）检测图像中像素值变化的位置，从而识别垂直或水平边缘。",中等,"edge detection,边缘检测",,
l2_kernel_learning,卷积核学习,KnowledgePoint,L2,通过梯度下降等优化方法，从输入-输出对中自动学习卷积核的权重参数，而不是手动设计。,高,"learnable kernel,kernel learning",,
l2_receptive_field,感受野,KnowledgePoint,L2,在前向传播中可能影响某一层某个元素计算的所有前层输入元素的集合。随着网络加深，感受野会扩大。,中等,receptive field,,
l2_multi_input_channels,多输入通道,KnowledgePoint,L2,当输入包含多个通道时，需要构造一个与输入数据具有相同输入通道数的卷积核，以便与输入数据进行互相关运算。每个通道分别进行互相关运算后对结果求和得到二维输出。,中等,"multi-input channels,multiple input channels",,
l2_multi_output_channels,多输出通道,KnowledgePoint,L2,通过为每个输出通道创建一个形状为$c_i \times k_h \times k_w$的卷积核张量，使得卷积层可以生成多个输出通道，从而学习不同特征的响应。,中等,"multi-output channels,multiple output channels",,
l2_1x1_convolution,$1\times 1$ 卷积层,KnowledgePoint,L2,$1\times 1$卷积在高度和宽度维度上不提取空间特征，仅在通道维度上进行线性变换，相当于在每个像素位置应用全连接层，用于调整通道数量和控制模型复杂性。,中等,"1x1 convolution,pointwise convolution",,
l2_max_pooling,最大汇聚层,KnowledgePoint,L2,在每个汇聚窗口中取最大值作为输出的汇聚操作，能保留最显著的特征并增强对小位移的鲁棒性。,基础,"maximum pooling,max pooling",,
l2_average_pooling,平均汇聚层,KnowledgePoint,L2,在每个汇聚窗口中取平均值作为输出的汇聚操作，对整体特征响应进行平滑处理。,基础,"average pooling,mean pooling",,
l2_pooling_stride_and_padding,汇聚层的填充与步幅,KnowledgePoint,L2,通过设置填充（padding）和步幅（stride）控制汇聚层输出的空间尺寸，类似于卷积层的机制。,中等,"padding and stride in pooling,pooling parameters",,
l2_multi_channel_pooling,多通道汇聚,KnowledgePoint,L2,在多通道输入上，汇聚层对每个通道独立进行操作，输出通道数与输入通道数相同。,中等,"channel-wise pooling,multi-channel pooling",,
l2_forward_propagation,前向传播,KnowledgePoint,L2,按顺序（从输入层到输出层）计算和存储神经网络中每层的结果，包括中间变量如加权输入、激活输出、损失项和正则化项。,基础,"forward propagation,forward pass",,
l2_backward_propagation,反向传播,KnowledgePoint,L2,基于链式法则，从输出层到输入层反向计算神经网络参数梯度的方法，用于更新模型权重，包含对中间变量和正则化项的梯度计算。,中等,"backward propagation,backpropagation",,
l2_computation_graph,计算图,KnowledgePoint,L2,用于可视化神经网络中变量与操作符之间依赖关系的有向图结构，其中方形表示变量，圆形表示操作符，箭头表示数据流向。,基础,computation graph,,
l2_l2_regularization,L2正则化,KnowledgePoint,L2,通过在目标函数中加入权重参数的Frobenius范数平方项（乘以超参数λ/2）来防止模型过拟合的正则化技术。,中等,"L2 regularization,weight decay,ridge regularization",,
l2_automatic_differentiation,自动微分,KnowledgePoint,L2,利用计算图和链式法则自动计算复杂函数梯度的技术，是深度学习框架实现反向传播的核心机制。,中等,"automatic differentiation,autodiff",,
l2_multilayer_perceptron,多层感知机,KnowledgePoint,L2,最简单的深度网络，由多层神经元组成，每一层与相邻上下层全连接，用于学习非线性函数映射。,基础,"Multilayer Perceptron,MLP",,
l2_overfitting,过拟合,KnowledgePoint,L2,模型在训练数据上表现很好但在测试数据上表现差的现象，通常由于模型容量过大或训练数据不足导致。,基础,overfitting,,
l2_underfitting,欠拟合,KnowledgePoint,L2,模型无法充分学习训练数据中的模式，导致在训练和测试数据上均表现不佳。,基础,underfitting,,
l2_model_selection,模型选择,KnowledgePoint,L2,在多个候选模型中选择最优模型的过程，通常基于验证集性能、交叉验证或信息准则等方法。,中等,model selection,,
l2_weight_decay,权重衰减,KnowledgePoint,L2,一种正则化技术，通过在损失函数中加入权重的L2范数惩罚项，限制模型复杂度以缓解过拟合。,中等,"weight decay,L2 regularization",,
l2_dropout,暂退法（Dropout）,KnowledgePoint,L2,一种在训练神经网络时通过随机丢弃部分神经元来防止过拟合的正则化技术，其核心思想是在前向传播过程中以一定概率将某些神经元的输出置零，并对保留的神经元进行缩放以保持期望不变。,中等,"Dropout regularization,dropout,神经元丢弃",,
