id,name,type,level,description,difficulty,aliases,url,resource_type
l3_construct_textcnn_architecture,构建textCNN模型架构,KnowledgePoint,L3,使用多个不同宽度的一维卷积核、最大时间汇聚层和全连接层构建完整的textCNN模型，包括双嵌入层（可训练和固定）的设计,高,"textCNN model construction,build textCNN architecture",,
l3_apply_pretrained_embeddings,应用预训练词向量,KnowledgePoint,L3,加载GloVe等预训练词向量初始化嵌入层，并设置一个嵌入层为可训练而另一个为固定权重,中等,"use pretrained embeddings,GloVe initialization",,
l3_concatenate_initial_final_hidden_states,拼接初始与最终时间步隐状态,KnowledgePoint,L3,在双向RNN中，将序列第一个和最后一个时间步的隐状态拼接，形成整个序列的固定长度表示。,中等,"concatenate first and last hidden states,initial-final state concatenation",,
l3_freeze_pretrained_embeddings,冻结预训练词向量参数,KnowledgePoint,L3,在训练过程中不更新预训练词向量的权重，以保留其语义信息并防止过拟合。,基础,"freeze embedding weights,non-trainable embeddings",,
l3_build_birnn_classifier,构建双向RNN分类器,KnowledgePoint,L3,通过嵌入层、双向LSTM编码器和全连接解码器构建用于文本分类的端到端模型。,中等,"BiRNN classifier construction,build BiLSTM for classification",,
l3_rnn_based_sentiment_model,基于循环神经网络的情感分析模型,KnowledgePoint,L3,使用循环神经网络（如LSTM或GRU）对文本序列建模，以进行情感分类。,中等,"RNN-based sentiment model,recurrent sentiment classifier",,
l3_cnn_based_sentiment_model,基于卷积神经网络的情感分析模型,KnowledgePoint,L3,利用卷积神经网络提取局部文本特征，用于情感分类任务。,中等,"CNN-based sentiment model,convolutional sentiment classifier",,
l3_attention_mlp_for_nli,基于注意力和多层感知机的自然语言推断模型,KnowledgePoint,L3,结合注意力机制与多层感知机，对文本对进行交互建模以完成自然语言推断任务。,高,"attention-MLP NLI model,NLI with attention and MLP",,
l3_bert_finetuning_for_nli,针对自然语言推断的BERT微调方法,KnowledgePoint,L3,将BERT模型应用于自然语言推断任务，仅需在顶部添加分类层并对整个模型进行微调。,高,"BERT fine-tuning for NLI,NLI with BERT",,
l3_read_snli_function,读取SNLI数据集函数,KnowledgePoint,L3,定义read_snli函数，用于解析SNLI原始数据文件，提取前提、假设及其对应的标签，并进行文本清洗和格式化。,中等,"read_snli,SNLI data parsing function",,
l3_snli_dataset_class,SNLI自定义数据集类,KnowledgePoint,L3,实现SNLIDataset类，用于加载SNLI数据，支持文本分词、词表构建、序列填充/截断，并提供__getitem__接口以供DataLoader使用。,高,"SNLIDataset class,custom SNLI dataset loader",,
l3_load_data_snli_function,加载SNLI数据迭代器函数,KnowledgePoint,L3,定义load_data_snli函数，整合数据读取、词表构建和DataLoader创建，返回训练/测试数据迭代器及共享词表，确保测试集使用训练集词表。,高,"load_data_snli,SNLI data pipeline function",,
l3_attend_step,注意步骤,KnowledgePoint,L3,在可分解注意力模型中，计算两个文本序列（前提和假设）之间的注意力权重，并生成彼此的软对齐表示（beta和alpha）。,中等,"Attending Step,Attention Computation",,
l3_compare_step,比较步骤,KnowledgePoint,L3,将每个序列中的词元与其在另一序列中的软对齐表示拼接后，通过多层感知机进行语义比较，生成比较向量。,中等,"Comparison Step,Semantic Comparison",,
l3_aggregate_step,聚合步骤,KnowledgePoint,L3,对两组比较向量分别求和并拼接，再通过多层感知机进行分类，输出前提与假设之间的逻辑关系（蕴涵、矛盾、中性）。,中等,"Aggregation Step,Classification Aggregation",,
l3_decomposable_attention_computation,可分解注意力计算,KnowledgePoint,L3,通过分别对两个序列的词向量应用相同的MLP函数后再点积，避免成对输入，将注意力计算复杂度从二次降至线性。,高,"Decomposable Attention Computation,Linear-complexity Attention",,
l3_truncate_pair_of_tokens,文本对截断策略,KnowledgePoint,L3,为满足BERT最大长度限制，持续从较长文本中移除末尾标记，直到总长度不超过max_len - 3（保留[CLS]和两个[SEP]位置）。,中等,"Token Pair Truncation,双文本截断",,
l3_snli_bert_dataset_construction,SNLI-BERT数据集构建,KnowledgePoint,L3,定义定制数据集类SNLIBERTDataset，将SNLI数据集中的前提-假设对转换为BERT输入格式（token IDs、segment IDs、valid lengths），并支持多进程加速。,高,"SNLI BERT Dataset Pipeline,构建微调数据集",,
l3_bert_classifier_head_design,BERT分类头设计,KnowledgePoint,L3,在BERT编码器输出的[CLS]向量上添加一个多层感知机（通常包含一个隐藏层和一个输出层）用于三分类任务（蕴涵、矛盾、中性）。,中等,"BERT Classification Head,MLP Classifier on [CLS]",,
l3_partial_finetuning_strategy,部分微调策略,KnowledgePoint,L3,在微调过程中，仅更新与下游任务相关的参数（如分类头），而预训练编码器和隐藏层参数也参与微调，但与预训练任务无关的参数（如MLM/NSP头）保持冻结。,高,"Selective Fine-tuning,Partial Parameter Update",,
l3_cls_token_representation_for_classification,使用[CLS]标记表示进行分类,KnowledgePoint,L3,在BERT微调中，利用特殊[CLS]标记的最终隐藏状态作为整个输入序列的聚合表示，并将其送入全连接层以输出分类结果。,中等,"[CLS] token for classification,classification using CLS representation",,
l3_token_wise_dense_layer_for_tagging,逐词元全连接层用于标注,KnowledgePoint,L3,在词元级任务中，将每个输入词元对应的BERT隐藏状态分别送入同一个全连接层，以预测该词元的标签。,中等,"per-token dense layer,token-wise classification head",,
l3_span_prediction_for_qa,基于跨度的问答预测,KnowledgePoint,L3,在问答任务中，使用两个独立的全连接层分别预测答案片段的起始位置和结束位置得分，通过softmax归一化后选择得分最高的有效跨度作为答案。,高,"span-based QA,start-end span prediction",,
l3_bert_input_format_for_pairs,BERT文本对输入格式,KnowledgePoint,L3,将两个文本拼接为一个序列，中间用[SEP]分隔，并在开头添加[CLS]标记，同时提供段落嵌入（segment embeddings）以区分两个句子。,基础,"BERT sentence pair input,two-sequence BERT input",,
l3_glove_loss_function,GloVe损失函数构建,KnowledgePoint,L3,构建GloVe的加权平方损失函数：∑∑ h(x_ij)(u_j^T v_i + b_i + c_j - log x_ij)^2，其中h(x)为权重函数，b_i和c_j为偏置项。,高,"GloVe loss formulation,weighted squared loss in GloVe",,
l3_weight_function_design,GloVe权重函数设计,KnowledgePoint,L3,设计权重函数h(x)，当x < c时h(x) = (x/c)^α，否则h(x)=1，以降低罕见共现对损失的过度影响并提升计算效率。,中等,"weighting function in GloVe,h(x) function",,
l3_vector_combination_in_glove,GloVe词向量组合方法,KnowledgePoint,L3,在GloVe中，由于中心词向量和上下文词向量数学上等价但训练后可能不同，通常将两者相加作为最终词向量输出。,基础,"vector addition in GloVe,output vector combination",,
l3_extract_character_ngrams,提取字符n-gram,KnowledgePoint,L3,在fastText中，对单词添加边界符号后，提取指定长度范围（如3到6）的所有字符n-gram作为子词单元。,中等,"character n-gram extraction,n-gram subword generation",,
l3_sum_subword_vectors,子词向量求和,KnowledgePoint,L3,在fastText中，将一个词的所有子词向量相加，得到该词的最终向量表示。,基础,"subword vector summation,aggregation of subword embeddings",,
l3_bpe_merge_symbols,BPE符号合并,KnowledgePoint,L3,在字节对编码中，迭代地找出训练数据中最频繁的连续符号对，并将其合并为新符号，直到达到预定的词表大小或合并次数。,中等,"BPE merging,symbol pair merging",,
l3_bpe_segmentation,BPE分词,KnowledgePoint,L3,使用已学习的BPE子词词表，将新词从最长匹配开始贪婪地切分为子词序列。,中等,"BPE tokenization,subword segmentation with BPE",,
l3_bert_token_segment_position_embedding,BERT词元-片段-位置嵌入组合,KnowledgePoint,L3,将词元嵌入、片段嵌入（A/B句标识）和可学习位置嵌入相加，形成最终输入向量，用于Transformer编码器。,中等,"token-segment-position embedding sum,BERT embedding composition",,
l3_mlm_noise_strategy,MLM掩蔽噪声策略,KnowledgePoint,L3,在MLM中，被选中的15%词元按80%替换为<mask>、10%替换为随机词、10%保持原词，以缓解预训练与微调阶段的分布不匹配问题。,高,"MLM masking strategy,masked token corruption",,
l3_nsp_cls_token_classification,NSP使用<cls>标记进行二分类,KnowledgePoint,L3,利用Transformer编码后<cls>位置的输出向量，通过一个带tanh激活的全连接层和线性分类器，预测两句话是否连续。,中等,"[CLS] token for NSP,sentence pair classification with [CLS]",,
l3_bert_pretraining_loss_combination,BERT预训练损失函数组合,KnowledgePoint,L3,将MLM任务的交叉熵损失与NSP任务的二分类交叉熵损失线性相加，作为BERT整体预训练目标函数。,中等,"combined pretraining loss,MLM+NSP loss",,
l3_generate_nsp_samples,生成下一句预测样本,KnowledgePoint,L3,通过从段落中提取相邻或随机句子对，并标注是否为真实连续句子，生成NSP任务的训练样本。,中等,"NSP data generation,next sentence sample creation",,
l3_generate_mlm_samples,生成遮蔽语言模型样本,KnowledgePoint,L3,对输入序列中15%的非特殊词元进行遮蔽处理（80%替换为<mask>，10%保持不变，10%替换为随机词），并记录原始标签用于训练。,高,"MLM data generation,masked token replacement",,
l3_pad_bert_inputs,填充BERT输入序列,KnowledgePoint,L3,将变长的BERT输入序列（包括token IDs、segment IDs、MLM位置等）填充至固定长度，并生成对应的掩码权重以忽略填充部分的损失计算。,中等,"BERT input padding,sequence padding for BERT",,
l3_tokenize_and_build_vocab,词元化与词表构建,KnowledgePoint,L3,对原始文本进行词元化处理，并基于最小频次过滤低频词，构建包含特殊标记（如<cls>、<sep>、<mask>、<pad>）的词汇表。,基础,"tokenization and vocabulary construction,vocab building",,
l3_read_ptb_dataset,读取PTB数据集,KnowledgePoint,L3,从Penn Tree Bank语料库中加载文本行列表，每行为一个由空格分隔的句子，并构建词表，将低频词替换为<unk>。,基础,"load PTB corpus,read Penn Tree Bank",,
l3_implement_subsampling_function,实现下采样函数,KnowledgePoint,L3,编写函数对语料中的每个词根据其频率和超参数t进行概率性丢弃，保留低频词并减少高频词数量。,中等,"subsampling implementation,frequency-based token filtering",,
l3_extract_center_context_pairs,提取中心词-上下文词对,KnowledgePoint,L3,实现get_centers_and_contexts函数，遍历语料，为每个词生成动态大小的上下文窗口，并排除中心词本身。,中等,"generate skip-gram pairs,context window extraction",,
l3_implement_random_generator_for_negative_sampling,实现负采样的随机生成器,KnowledgePoint,L3,构建RandomGenerator类，根据未归一化的采样权重（词频^0.75）高效地生成噪声词索引，支持缓存以提升性能。,高,"RandomGenerator for negative sampling,weighted random sampler",,
l3_generate_negatives_for_contexts,为上下文生成噪声词,KnowledgePoint,L3,实现get_negatives函数，为每个上下文词对采样K个不在上下文中的噪声词，基于词频的0.75次幂分布。,高,"noise word generation,negative example sampling",,
l3_batchify_skip_gram_samples,批处理跳元模型样本,KnowledgePoint,L3,实现batchify函数，将变长的中心词-上下文-噪声三元组填充为固定长度张量，并生成对应的掩码和标签张量用于损失计算。,高,"skip-gram batch collation,variable-length batch padding",,
l3_integrate_ptb_data_loader,整合PTB数据加载器,KnowledgePoint,L3,实现load_data_ptb函数，封装整个数据预处理流程（读取、词表、下采样、中心-上下文提取、负采样），返回可迭代的数据加载器和词表。,高,"PTB data pipeline,word2vec data loader",,
l3_predict_masked_tokens,预测掩码词元,KnowledgePoint,L3,通过使用周围文本的其它部分来预测文本中被隐藏（掩码）的部分，是自监督预训练的一种常见方法,中等,"masked language modeling,MLM",,
l3_use_word2vec_glove_subword,使用word2vec、GloVe或子词嵌入进行预训练,KnowledgePoint,L3,在大型语料库上使用word2vec、GloVe或子词嵌入模型为每个词元生成固定向量表示,基础,static word embedding training,,
l3_apply_bert_style_pretraining,应用BERT式预训练,KnowledgePoint,L3,使用基于Transformer编码器的深度自监督模型（如BERT）对文本进行上下文感知的预训练,高,"BERT pretraining,Transformer-based pretraining",,
l3_skip_gram_training,跳元模型训练方法,KnowledgePoint,L3,通过最大化似然函数（即最小化负对数似然损失）并使用随机梯度下降更新中心词向量和上下文词向量，利用softmax建模条件概率。,高,"skip-gram training,skip-gram optimization",,
l3_cbow_training,连续词袋模型训练方法,KnowledgePoint,L3,通过最小化负对数似然损失，对上下文词向量取平均后使用softmax预测中心词，并通过梯度下降更新词向量。,高,"CBOW training,CBOW optimization",,
l3_gradient_computation_skip_gram,跳元模型梯度计算,KnowledgePoint,L3,计算对数条件概率关于中心词向量的梯度，公式为上下文词向量减去所有词的条件概率加权平均的上下文词向量。,高,"skip-gram gradient,gradient of skip-gram",,
l3_gradient_computation_cbow,连续词袋模型梯度计算,KnowledgePoint,L3,计算对数条件概率关于上下文词向量的梯度，公式为(1/2m)乘以（中心词向量减去所有词的条件概率加权平均的中心词向量）。,高,"CBOW gradient,gradient of CBOW",,
l3_knn_for_word_similarity,基于k近邻的词相似度计算,KnowledgePoint,L3,使用k近邻（kNN）算法，根据词向量间的余弦相似度找出与查询词最相似的k个词,中等,"k-nearest neighbors for word similarity,cosine similarity search",,
l3_vector_arithmetic_for_analogy,基于向量运算的词类比求解,KnowledgePoint,L3,通过向量加减运算（vec(b) - vec(a) + vec(c)）并结合最近邻搜索，完成词类比任务,中等,"vector arithmetic for word analogy,analogy solving with embeddings",,
l3_loading_pretrained_embeddings,加载预训练词嵌入,KnowledgePoint,L3,从GloVe或fastText等来源下载并加载预训练词向量，构建词到索引及向量的映射,基础,"loading GloVe embeddings,loading fastText embeddings",,
l3_negative_sampling_loss_computation,负采样损失计算,KnowledgePoint,L3,在负采样中，对数损失由正样本的sigmoid输出和K个负样本的sigmoid负输出之和构成，具体形式为：-log σ(u_o^T v_c) - Σ_{k=1}^K log σ(-u_{h_k}^T v_c)，其中K为噪声词数量。,高,"negative sampling loss,NS loss calculation",,
l3_hierarchical_softmax_probability_estimation,分层softmax概率估计,KnowledgePoint,L3,在分层softmax中，给定中心词w_c生成上下文词w_o的条件概率通过从根到w_o叶节点路径上各非叶节点的sigmoid函数乘积计算，方向由左右子节点决定，使用指示函数[![·]]将方向映射为±1。,高,"h-softmax probability,path-based probability estimation",,
l3_bert_loss_computation,BERT损失计算,KnowledgePoint,L3,实现遮蔽语言建模损失与下一句预测损失的联合计算，包括权重归一化和梯度回传。,高,"BERT loss calculation,联合任务损失函数",,
l3_bert_text_encoding,BERT文本编码,KnowledgePoint,L3,使用预训练BERT模型对单句或句子对进行编码，提取[CLS]标记或任意词元的上下文表示向量。,中等,"BERT encoding,文本特征提取",,
l3_wikitext2_data_loading,WikiText-2数据加载与预处理,KnowledgePoint,L3,从WikiText-2数据集加载文本，生成适用于BERT预训练的样本格式，包括分段、遮蔽和NSP标签构建。,中等,"WikiText-2 preprocessing,预训练数据构建",,
l3_skip_gram_forward_propagation,跳元模型前向传播实现,KnowledgePoint,L3,通过两个嵌入层分别获取中心词和上下文/噪声词的向量表示，并使用批量矩阵乘法计算点积得分,中等,"skip-gram forward pass,skip gram implementation",,
l3_sigmoid_bce_loss_with_mask,带掩码的二元交叉熵损失计算,KnowledgePoint,L3,在负采样中，对有效预测位置（非填充）应用二元交叉熵损失，并通过掩码进行归一化处理,高,"masked binary cross-entropy loss,SigmoidBCELoss with mask",,
l3_find_similar_tokens_by_cosine,基于余弦相似度查找相似词,KnowledgePoint,L3,利用训练好的词嵌入矩阵，计算输入词与其他所有词的余弦相似度，并返回最相似的k个词,中等,"find similar words by cosine,semantic similarity search",,
l3_gradient_aggregation_on_single_gpu,单GPU梯度聚合,KnowledgePoint,L3,在多GPU数据并行中，将所有GPU计算的梯度集中到一个GPU（如GPU 0）上进行聚合，再广播更新后的参数。,中等,"Centralized Gradient Aggregation,Single-GPU Reduce",,
l3_partitioned_gradient_aggregation,分片梯度聚合,KnowledgePoint,L3,将梯度向量划分为多个部分，不同GPU分别负责聚合不同部分，利用PCIe交换机的全带宽能力并行执行，提升同步效率。,高,"Sharded Gradient Aggregation,Partitioned Reduce",,
l3_ring_allreduce_algorithm,环形All-Reduce算法,KnowledgePoint,L3,将梯度分为n个块，每个节点同时发送和接收不同块，在n-1步内完成全梯度聚合，通信时间与节点数无关。,高,"Ring All-Reduce,Ring-Based Gradient Synchronization",,
l3_multi_parameter_server_architecture,多参数服务器架构,KnowledgePoint,L3,将模型参数分片存储在多个参数服务器上，每个服务器负责一部分参数的聚合与更新，从而突破单服务器带宽瓶颈。,高,"Distributed Parameter Server,Sharded PS",,
l3_push_pull_operations,Push/Pull操作,KnowledgePoint,L3,在键值存储抽象中，工作节点通过push操作上传本地梯度，通过pull操作获取全局聚合后的参数，实现解耦的分布式训练接口。,中等,"Push-Pull API,KV Push/Pull",,
l3_split_and_load_batch,拆分并加载小批量数据,KnowledgePoint,L3,将一个训练批次的数据均匀切分并分配到多个GPU设备上，以便并行处理。,中等,"split_and_load,batch sharding",,
l3_aggregate_gradients_across_gpus,跨GPU梯度聚合,KnowledgePoint,L3,在多GPU训练中，将各设备上计算的梯度进行汇总（如求平均），用于统一更新模型参数。,高,"gradient aggregation,all-reduce gradients",,
l3_use_high_level_apis_for_multi_gpu,使用高级API实现多GPU训练,KnowledgePoint,L3,通过深度学习框架（如PyTorch的DataParallel、MXNet的ctx列表）提供的高层接口简化多GPU训练实现。,中等,"high-level multi-GPU API,framework-native parallelism",,
l3_evaluate_accuracy_on_multiple_gpus,多GPU上的模型精度评估,KnowledgePoint,L3,在多个GPU上并行执行模型推理，并汇总预测结果以计算整体准确率。,中等,"multi-GPU evaluation,distributed accuracy computation",,
l3_distribute_parameters_to_devices,向多个设备分发模型参数,KnowledgePoint,L3,将完整的模型参数复制到每个GPU设备上，并为每个副本启用梯度追踪。,中等,"parameter distribution,copy parameters to GPUs",,
l3_split_batch_across_gpus,将小批量数据均匀分配到多个GPU,KnowledgePoint,L3,将输入数据和标签按批次维度均匀切分，并加载到各个GPU设备上，确保每个GPU处理相等的数据量。,基础,"data sharding,batch splitting",,
l3_aggregate_and_broadcast_gradients,聚合梯度并广播到所有GPU,KnowledgePoint,L3,在每个GPU完成局部反向传播后，收集所有GPU上的对应参数梯度，求和后将结果广播回所有GPU，实现参数同步。,中等,"gradient synchronization,allreduce gradients",,
l3_update_parameters_on_each_gpu,在每个GPU上独立更新参数,KnowledgePoint,L3,使用聚合后的全局梯度，在每个GPU上独立地执行优化器步骤（如SGD）来更新其本地参数副本。,基础,"local parameter update,distributed SGD step",,
l3_waitall_synchronization,全局同步（waitall）,KnowledgePoint,L3,调用框架提供的全局同步函数（如npx.waitall()、torch.cuda.synchronize()）以等待所有已提交的异步操作完成。,基础,"waitall,global synchronization",,
l3_wait_to_read_synchronization,变量级同步（wait_to_read）,KnowledgePoint,L3,仅等待特定变量的计算完成，而不是所有操作，适用于细粒度控制。,中等,"wait_to_read,variable-level synchronization",,
l3_implicit_blocking_via_conversion,通过类型转换隐式阻塞,KnowledgePoint,L3,将张量转换为NumPy数组（.asnumpy()）或标量（.item()）会触发隐式同步，因为目标类型不支持异步语义。,基础,"implicit blocking via conversion,asnumpy/item blocking",,
l3_asynchronous_vs_synchronous_benchmarking,异步与同步性能基准测试,KnowledgePoint,L3,通过插入显式同步点（如wait_to_read）模拟同步执行，并与纯异步执行对比性能差异。,中等,"async vs sync benchmarking,performance comparison",,
l3_burst_read_optimization,突发读取优化,KnowledgePoint,L3,通过连续访问内存块而非随机访问，利用DRAM的突发传输机制大幅降低有效延迟，提升内存带宽利用率。,中等,"burst read,sequential memory access",,
l3_memory_alignment,内存对齐,KnowledgePoint,L3,将数据结构按64位边界对齐，避免跨缓存行访问，减少内存访问开销并提升缓存效率。,基础,"memory alignment,data structure alignment",,
l3_cache_locality,缓存局部性优化,KnowledgePoint,L3,通过设计算法以提高时间局部性和空间局部性，使频繁访问的数据保留在高速缓存中，减少主存访问次数。,中等,"cache locality,locality of reference",,
l3_communication_computation_overlap,通信与计算重叠,KnowledgePoint,L3,在分布式训练中，通过异步或流水线方式将数据传输（如GPU间同步）与计算操作并行执行，隐藏通信延迟。,高,"overlap communication and computation,asynchronous data transfer",,
l3_precision_selection,数值精度选择,KnowledgePoint,L3,根据任务需求（训练需FP16/FP32，推理可用INT8/INT4）选择合适的数值格式，在保证模型精度的同时提升计算效率和内存带宽。,中等,"precision selection,mixed-precision training,quantization",,
l3_mxnet_hybridize,MXNet hybridize方法,KnowledgePoint,L3,在MXNet中通过调用HybridBlock或HybridSequential实例的hybridize()方法，将命令式模型编译为符号式图以提升性能。,中等,"hybridize,Gluon hybridization",,
l3_pytorch_torchscript,PyTorch TorchScript转换,KnowledgePoint,L3,使用torch.jit.script将PyTorch模型从动态图（命令式）转换为静态图（符号式），用于部署和性能优化。,中等,"torchscript,torch.jit.script",,
l3_tensorflow_tf_function,TensorFlow tf.function装饰器,KnowledgePoint,L3,使用tf.function将Python函数自动转换为计算图，启用图模式执行和XLA编译优化，提升运行效率。,中等,"tf.function,autograph,graph mode",,
l3_paddle_to_static,飞桨 to_static 转换,KnowledgePoint,L3,使用paddle.jit.to_static将动态图模型转换为静态图，实现符号式执行以提升性能和部署能力。,中等,"to_static,paddle.jit.to_static",,
l3_model_serialization,编译模型序列化,KnowledgePoint,L3,将编译后的符号式模型及其参数保存为磁盘文件（如JSON+二进制），便于跨平台部署和非Python环境使用。,中等,"model export,serialization,model saving",,
l3_device_warmup_and_synchronization,设备预热与同步,KnowledgePoint,L3,在性能测量前对设备执行一次传递以预热缓存，并使用同步函数（如npx.waitall()、torch.cuda.synchronize()）确保所有计算完成后再进行计时。,中等,"device warm-up and synchronization,GPU synchronization",,
l3_non_blocking_data_transfer,非阻塞数据传输,KnowledgePoint,L3,在PyTorch等框架中使用non_blocking=True参数，在GPU仍在计算时就开始将部分结果复制到CPU，利用PCIe带宽重叠计算与通信。,高,"non-blocking data transfer,asynchronous memory copy",,
l3_multi_device_task_scheduling,多设备任务调度,KnowledgePoint,L3,深度学习框架自动调度多个不相互依赖的任务到不同设备（如两个GPU）上并行执行，无需用户手动编写复杂调度代码。,中等,"multi-device task scheduling,automatic device scheduling",,
l3_construct_fcn_model,构造全卷积网络模型,KnowledgePoint,L3,使用预训练的卷积神经网络（如ResNet-18）提取特征，移除全局平均池化和全连接层，添加1×1卷积层调整通道数，并使用转置卷积层恢复空间分辨率。,中等,"build FCN model,construct fully convolutional network",,
